{"batch_id":"xref_batch_000000000000000000000000","edges":[{"kind":"supports","origin":"source_local","relationship_id":null,"source":"LIB-901:evidence:synthetic-observation","target":"LIB-901:atom:indicator-response"},{"kind":"supports","origin":"source_local","relationship_id":null,"source":"LIB-902:evidence:synthetic-model","target":"LIB-902:atom:delay-model"},{"kind":"potential_support","origin":"cross_source","relationship_id":"xref_rel_18065fed5f65965aae1d6d04","source":"LIB-902:atom:delay-model","target":"LIB-901:atom:indicator-response"}],"nodes":[{"id":"LIB-901:evidence:synthetic-observation","payload":{"asset_sha256":"ce065c8cde8caa6e51ec405febe6e3d1c39dfcff2602d147670db662f9cbd80d","exact_span":"In the invented apparatus, the blue indicator activates after the control pulse.","locator":"Invented source A, synthetic observation","page_end":1,"page_start":1,"schema_version":1,"source_id":"LIB-901"},"record_type":"evidence","revision":1,"source_id":"LIB-901"},{"id":"LIB-901:atom:indicator-response","payload":{"attribution":"Synthetic source A","connectable":true,"epistemic_posture":"Invented observation, not an empirical claim.","evidence_ids":["LIB-901:evidence:synthetic-observation"],"fidelity":null,"kind":"observation","label":"Indicator response","qualifications":["No real paper, apparatus, or result is represented."],"schema_version":1,"scope":"Invented apparatus used only for the public demonstration.","source_id":"LIB-901","standalone_context":"A pulse precedes an indicator response in a toy system.","statement":"The fictional blue indicator follows the control pulse.","type_gap":null},"record_type":"atom","revision":1,"source_id":"LIB-901"},{"id":"LIB-902:evidence:synthetic-model","payload":{"asset_sha256":"8912b672cd9df10b7d432e0492e0a3a0e0a8c11d6f3ef66d85b0be00ea3a0907","exact_span":"The invented delay model predicts an indicator response one step after a pulse.","locator":"Invented source B, synthetic model","page_end":1,"page_start":1,"schema_version":1,"source_id":"LIB-902"},"record_type":"evidence","revision":1,"source_id":"LIB-902"},{"id":"LIB-902:atom:delay-model","payload":{"attribution":"Synthetic source B","connectable":true,"epistemic_posture":"Invented model, not a scientific conclusion.","evidence_ids":["LIB-902:evidence:synthetic-model"],"fidelity":null,"kind":"model","label":"One-step delay model","qualifications":["The model is illustrative and has no external source."],"schema_version":1,"scope":"Invented discrete-time system used only for the public demonstration.","source_id":"LIB-902","standalone_context":"A toy model links a pulse to a later indicator response.","statement":"A fictional one-step delay model predicts the indicator response.","type_gap":null},"record_type":"atom","revision":1,"source_id":"LIB-902"}],"schema_version":1,"sources":["LIB-901","LIB-902"]}
